{
  "$schema": "http://json-schema.org/draft-07/schema#",
  "$id": "https://ai4ia/foundry/a2a.schema.json",
  "title": "AI4IA Foundry A2A integration design manifest",
  "description": "Validation and planning contract for a proposed A2A integration. It is deliberately not callable: the repository has no validated protocol/version negotiation, endpoint discovery, backend auth, APIM operation/product/policy, or runtime client wiring. scripts/provision-foundry-a2a.py validates and reports those blockers; it does not emit executable commands or an AgentSpec.",
  "type": "object",
  "additionalProperties": false,
  "required": ["manifestVersion", "lifecycle", "owner", "sdkContract", "agentName", "displayName", "description", "linkAs", "blockingRequirements"],
  "properties": {
    "$schema": { "type": "string" },
    "_comment": { "type": "string" },
    "manifestVersion": { "const": "1.0" },
    "lifecycle": {
      "const": "design-preview",
      "description": "Validated design artifact only; no callable integration is provisioned or served."
    },
    "owner": { "type": "string", "minLength": 1 },
    "sdkContract": {
      "type": "object",
      "additionalProperties": false,
      "required": ["package", "version", "status", "surface"],
      "properties": {
        "package": { "const": "azure-ai-projects" },
        "version": { "const": "2.8.0" },
        "status": { "const": "not-executable" },
        "surface": { "const": "no-validated-inbound-a2a-surface" }
      }
    },
    "agentName": {
      "type": "string",
      "description": "Proposed Foundry agent identifier. This design does not prove that the agent exists or expose an endpoint.",
      "minLength": 1
    },
    "displayName": {
      "type": "string",
      "description": "Human-readable name shown in the app's @-menu when the remote agent is registered.",
      "minLength": 1
    },
    "description": {
      "type": "string",
      "description": "What the remote agent does (helps routing/delegation).",
      "minLength": 1,
      "maxLength": 512
    },
    "linkAs": {
      "type": "string",
      "description": "Local catalog agent name to register the remote A2A agent as, so other agents can delegate to it via their `links`. Lowercase slug.",
      "pattern": "^[a-z][a-z0-9-]{0,38}[a-z0-9]$"
    },
    "blockingRequirements": {
      "type": "array",
      "description": "Executable contracts that must be designed, implemented, and tested before lifecycle may become active.",
      "uniqueItems": true,
      "minItems": 7,
      "items": {
        "enum": [
          "protocol-and-version",
          "endpoint-discovery",
          "backend-authentication",
          "apim-operation",
          "apim-product-and-subscription",
          "apim-policy",
          "runtime-client-wiring"
        ]
      }
    }
  }
}
