{
  "$schema": "./a2a.schema.json",
  "_comment": "DESIGN-ONLY A2A example. Copy/edit and run scripts/provision-foundry-a2a.py to validate the proposal and print its unresolved executable contracts. It does not create an endpoint, APIM surface, auth path, product/subscription, policy, or app runtime client.",
  "manifestVersion": "1.0",
  "lifecycle": "design-preview",
  "owner": "repository-owner",
  "sdkContract": {
    "package": "azure-ai-projects",
    "version": "2.8.0",
    "status": "not-executable",
    "surface": "no-validated-inbound-a2a-surface"
  },
  "agentName": "ai4ia-research-agent",
  "displayName": "Research Agent (A2A)",
  "description": "Proposed remote research agent. Endpoint, APIM authentication, and runtime delegation remain blocking design requirements.",
  "linkAs": "remote-research",
  "blockingRequirements": [
    "protocol-and-version",
    "endpoint-discovery",
    "backend-authentication",
    "apim-operation",
    "apim-product-and-subscription",
    "apim-policy",
    "runtime-client-wiring"
  ]
}
